{
    "$schema": "./schemas/scenario-catalogue.schema.json",
    "version": "v2026-07-21-002",
    "scope": "integration",
    "description": "Scenario catalogue for cross-module behaviours that combine parser, template engine and CLI parsing concerns.",
    "required_fields": [
        "id",
        "objective",
        "requirements",
        "fixtures",
        "expected_outcomes"
    ],
    "scenarios": [
        {
            "id": "IT-PARSE-SAMPLE-001",
            "objective": "Verify that valid sample BibTeX input is parsed into expected entry metadata.",
            "requirements": [
                "FUNC-1",
                "FUNC-1.5"
            ],
            "fixtures": [
                "input_sample_bib"
            ],
            "expected_outcomes": [
                "Parsing succeeds without errors.",
                "At least one entry is returned.",
                "Representative entry keys and entry types match fixture expectations."
            ]
        },
        {
            "id": "IT-AUTHOR-NORMALISATION-001",
            "objective": "Verify that author names in both supported formats are normalised and exposed as structured parts.",
            "requirements": [
                "FUNC-1.1"
            ],
            "fixtures": [
                "inline_author_formats"
            ],
            "expected_outcomes": [
                "Normalised author display values use a consistent representation.",
                "Structured given-name and family-name parts are available for template rendering."
            ]
        },
        {
            "id": "IT-AUTHOR-NORMALISATION-002",
            "objective": "Verify that author list splitting and name-part semantics follow BibTeX conventions for brace-protected literal names, case-insensitive separators, line-wrapped author fields, nobiliary particles and suffixes.",
            "requirements": [
                "FUNC-1.1",
                "FUNC-1.1.1",
                "FUNC-1.1.2"
            ],
            "fixtures": [
                "inline_author_edge_forms"
            ],
            "expected_outcomes": [
                "Brace-protected corporate names are treated as single literal authors and are never split at an embedded 'and'.",
                "The author list separator is matched case-insensitively and across line-wrapped whitespace.",
                "Nobiliary particles are exposed as part of the family-name part and suffixes are preserved in the normalised full name."
            ]
        },
        {
            "id": "IT-FIELD-WHITESPACE-001",
            "objective": "Verify that line-wrapped BibTeX field values are flattened without gaining extra internal whitespace from source indentation.",
            "requirements": [
                "FUNC-1",
                "FUNC-1.6"
            ],
            "fixtures": [
                "inline_wrapped_field_values"
            ],
            "expected_outcomes": [
                "Whitespace runs containing a line break collapse to a single space in template-visible field values.",
                "Line-wrapped title and keyword values match their single-line equivalents."
            ]
        },
        {
            "id": "IT-NONSTANDARD-FIELDS-001",
            "objective": "Verify that non-standard BibTeX fields are preserved and exposed to templates.",
            "requirements": [
                "FUNC-1.2",
                "FUNC-2"
            ],
            "fixtures": [
                "inline_non_standard_fields",
                "template_entry_md"
            ],
            "expected_outcomes": [
                "Non-standard fields remain available through the template context.",
                "Rendered output includes representative non-standard values."
            ]
        },
        {
            "id": "IT-DATE-NORMALISATION-001",
            "objective": "Verify that month and day values are normalised to zero-prefixed numeric strings.",
            "requirements": [
                "FUNC-1.3"
            ],
            "fixtures": [
                "inline_month_and_day_formats"
            ],
            "expected_outcomes": [
                "Named and numeric month values are converted to a consistent numeric representation.",
                "Single-digit month and day values are zero-prefixed."
            ]
        },
        {
            "id": "IT-SLUGIFIED-KEYWORDS-001",
            "objective": "Verify that keywords are exposed as a slugified string array for template consumption.",
            "requirements": [
                "FUNC-1.4"
            ],
            "fixtures": [
                "inline_keywords_mixed_punctuation"
            ],
            "expected_outcomes": [
                "The slugified keywords field is available as an array.",
                "Non-alphanumeric characters are replaced with hyphens in each slugified keyword."
            ]
        },
        {
            "id": "IT-RAW-BIBTEX-001",
            "objective": "Verify that the original BibTeX entry is exposed through the raw_bibtex field.",
            "requirements": [
                "FUNC-2.3"
            ],
            "fixtures": [
                "inline_raw_bibtex_entry"
            ],
            "expected_outcomes": [
                "The raw_bibtex field is present in the template context.",
                "Rendered output preserves representative original BibTeX content."
            ]
        },
        {
            "id": "IT-SINGLE-MODE-CONTEXT-001",
            "objective": "Verify that single-output rendering exposes the entries collection and supports deterministic output naming inputs.",
            "requirements": [
                "FUNC-2.4",
                "IF-CLI-1.9"
            ],
            "fixtures": [
                "inline_multiple_entries",
                "template_single_entries"
            ],
            "expected_outcomes": [
                "The template context exposes the entries collection.",
                "Rendered output can iterate across all selected entries.",
                "Inputs needed for combined single-mode file naming are available and testable."
            ]
        },
        {
            "id": "IT-FILTER-BY-TYPE-001",
            "objective": "Verify that include-type and exclude-type selectors apply correctly and combine predictably with key selectors.",
            "requirements": [
                "IF-CLI-1.4.1",
                "IF-CLI-1.5.1",
                "IF-CLI-2.2.1",
                "IF-CLI-2.3.1"
            ],
            "fixtures": [
                "input_sample_bib",
                "selected_entry_keys",
                "selected_entry_types"
            ],
            "expected_outcomes": [
                "Include-type returns only entries with matching entry_type values.",
                "Exclude-type omits entries with excluded entry_type values.",
                "When key and type selectors are both provided, both constraints are applied."
            ]
        },
        {
            "id": "IT-ERROR-SURFACING-001",
            "objective": "Verify that invalid template or input conditions surface actionable errors rather than being silently ignored.",
            "requirements": [
                "FUNC-1.5",
                "FUNC-2.5",
                "FUNC-5"
            ],
            "fixtures": [
                "invalid_template_comment_syntax",
                "missing_input_path",
                "missing_template_path"
            ],
            "expected_outcomes": [
                "Invalid template syntax produces an error that exposes the underlying rendering or parsing issue.",
                "Missing or invalid input artefacts fail immediately with an informative error message."
            ]
        },
        {
            "id": "IT-LATEX-SUBSTITUTION-MATH-MODE-001",
            "objective": "Verify that latex_substitute does not modify content inside supported math mode regions while still substituting outside those regions.",
            "requirements": [
                "FUNC-4",
                "IF-TPL-1"
            ],
            "fixtures": [
                "inline_latex_math_mode_bib",
                "template_latex_substitute"
            ],
            "expected_outcomes": [
                "Substitutions are applied for matching LaTeX snippets outside math mode regions.",
                "Content enclosed by $...$, $$...$$, \\(...\\), and \\[...\\] remains unchanged."
            ]
        },
        {
            "id": "IT-LATEX-SUBSTITUTION-MATH-MODE-002",
            "objective": "Verify that latex_substitute preserves supported math mode regions when real built-in default-map tokens are present.",
            "requirements": [
                "FUNC-4",
                "IF-TPL-1"
            ],
            "fixtures": [
                "inline_latex_math_mode_real_tokens_bib",
                "template_latex_substitute"
            ],
            "expected_outcomes": [
                "Built-in default substitutions are applied for matching LaTeX snippets outside math mode regions.",
                "Real built-in tokens inside $...$, $$...$$, \\(...\\), and \\[...\\] remain unchanged."
            ]
        },
        {
            "id": "IT-LATEX-SUBSTITUTION-MATH-MODE-003",
            "objective": "Verify that latex_substitute treats an unclosed $$ opener as plain text and still preserves a later valid $...$ math segment.",
            "requirements": [
                "FUNC-4",
                "IF-TPL-1"
            ],
            "fixtures": [
                "inline_latex_math_mode_unclosed_double_dollar_bib",
                "template_latex_substitute",
                "inline_custom_latex_substitution_map"
            ],
            "expected_outcomes": [
                "The unmatched $$ opener is treated as plain text for substitution purposes.",